[
  {
    "id": "e-transverse-bb1-001",
    "chapter": "transverse",
    "title": "Croissance d'une newsletter et script Python",
    "difficulty": 1,
    "estimatedMinutes": 30,
    "totalMarks": 7,
    "order": 10,
    "tags": [
      "suites",
      "arithmetique",
      "python",
      "somme",
      "modelisation"
    ],
    "preamble": "Camille lance une newsletter en janvier 2026. Au premier jour, elle compte $200$ abonnés. Une étude marketing montre que, chaque mois, le nombre d'abonnés augmente de $50$ personnes.\n\nPour tout entier naturel $n$, on note $u_n$ le nombre d'abonnés à la newsletter au début du $(n+1)$-ième mois. Ainsi $u_0 = 200$ correspond au mois de janvier 2026, $u_1$ au mois de février 2026, etc.",
    "questions": [
      {
        "id": "q1",
        "label": "1.",
        "statement": "Calculer $u_1$ et $u_2$. Justifier que la suite $(u_n)$ est arithmétique et préciser sa raison.",
        "marks": 1,
        "hints": [
          "Chaque mois, on ajoute $50$ abonnés au nombre du mois précédent.",
          "Calcule $u_1 = u_0 + 50$ puis $u_2 = u_1 + 50$.",
          "Une suite vérifiant $u_{n+1} = u_n + r$ avec $r$ constant est arithmétique de raison $r$."
        ],
        "expectedAnswer": "$u_1 = 250$, $u_2 = 300$ ; $(u_n)$ est arithmétique de raison $r = 50$.",
        "solution": "Le nombre d'abonnés augmente de $50$ chaque mois. Donc, pour tout entier naturel $n$ :\n$$u_{n+1} = u_n + 50.$$\n\nEn particulier :\n- $u_1 = u_0 + 50 = 200 + 50 = 250$ ;\n- $u_2 = u_1 + 50 = 250 + 50 = 300$.\n\nComme $u_{n+1} - u_n = 50$ est constant, la suite $(u_n)$ est **arithmétique** de raison $r = 50$ et de premier terme $u_0 = 200$."
      },
      {
        "id": "q2",
        "label": "2.",
        "statement": "Exprimer $u_n$ en fonction de $n$. En déduire le nombre d'abonnés au début du mois de janvier 2027.",
        "marks": 1.5,
        "hints": [
          "Pour une suite arithmétique, $u_n = u_0 + n \\times r$.",
          "Janvier 2027 correspond à $12$ mois après janvier 2026, donc à $n = 12$.",
          "Calcule $u_{12} = 200 + 12 \\times 50$."
        ],
        "expectedAnswer": "$u_n = 200 + 50n$ et $u_{12} = 800$ abonnés.",
        "solution": "La suite $(u_n)$ est arithmétique de premier terme $u_0 = 200$ et de raison $r = 50$. Pour tout entier naturel $n$ :\n$$u_n = u_0 + n \\times r = 200 + 50 n.$$\n\nLe mois de janvier 2027 se situe $12$ mois après janvier 2026, donc correspond à $n = 12$. On obtient :\n$$u_{12} = 200 + 50 \\times 12 = 200 + 600 = 800.$$\n\nAinsi, au début du mois de janvier 2027, la newsletter comptera $800$ abonnés."
      },
      {
        "id": "q3",
        "label": "3.",
        "statement": "Étudier le sens de variation de la suite $(u_n)$. Justifier la réponse.",
        "marks": 1,
        "hints": [
          "Pour étudier le sens de variation d'une suite, on étudie le signe de $u_{n+1} - u_n$.",
          "Ici, $u_{n+1} - u_n = 50$.",
          "Si cette différence est strictement positive pour tout $n$, la suite est strictement croissante."
        ],
        "expectedAnswer": "$(u_n)$ est strictement croissante car $u_{n+1} - u_n = 50 > 0$.",
        "solution": "Pour tout entier naturel $n$ :\n$$u_{n+1} - u_n = 50.$$\n\nOr $50 > 0$, donc $u_{n+1} > u_n$ pour tout $n \\in \\mathbb{N}$.\n\nLa suite $(u_n)$ est donc **strictement croissante**, ce qui est cohérent avec le contexte : le nombre d'abonnés augmente chaque mois."
      },
      {
        "id": "q4",
        "label": "4.",
        "statement": "On note $S = u_0 + u_1 + u_2 + \\ldots + u_{11}$ le nombre total d'abonnés cumulés sur les $12$ premiers mois (de janvier à décembre 2026). Calculer $S$.",
        "marks": 1.5,
        "hints": [
          "La somme des termes consécutifs d'une suite arithmétique vaut $\\dfrac{(\\text{nombre de termes}) \\times (\\text{premier} + \\text{dernier})}{2}$.",
          "Il y a $12$ termes (de $u_0$ à $u_{11}$). Calcule d'abord $u_{11} = 200 + 50 \\times 11$.",
          "$S = \\dfrac{12 \\times (u_0 + u_{11})}{2} = 6 \\times (u_0 + u_{11})$."
        ],
        "expectedAnswer": "$S = 5\\,700$.",
        "solution": "La somme $S$ contient $12$ termes consécutifs (de $u_0$ à $u_{11}$) d'une suite arithmétique. La formule de la somme s'écrit :\n$$S = \\dfrac{(\\text{nombre de termes}) \\times (\\text{premier terme} + \\text{dernier terme})}{2}.$$\n\nCalculons d'abord $u_{11}$ :\n$$u_{11} = 200 + 50 \\times 11 = 200 + 550 = 750.$$\n\nDonc :\n$$S = \\dfrac{12 \\times (200 + 750)}{2} = \\dfrac{12 \\times 950}{2} = 6 \\times 950 = 5\\,700.$$\n\nAinsi, $S = 5\\,700$ : la somme des nombres d'abonnés relevés au début de chacun des $12$ mois de l'année 2026 vaut $5\\,700$."
      },
      {
        "id": "q5",
        "label": "5.",
        "statement": "On considère le script Python ci-dessous, censé renvoyer la valeur de $u_N$ pour un entier naturel $N$ donné :\n\n```python\ndef abonnes(N):\n    u = 200\n    for i in range(...):\n        u = u + ...\n    return u\n```\n\nRecopier et compléter les deux pointillés pour que la fonction renvoie correctement $u_N$. Justifier brièvement.",
        "marks": 1,
        "hints": [
          "Initialement, $u$ vaut $u_0 = 200$. À chaque tour de boucle, on doit passer de $u_i$ à $u_{i+1}$.",
          "Pour atteindre $u_N$ en partant de $u_0$, il faut effectuer $N$ passages successifs, donc $N$ tours de boucle.",
          "La relation $u_{n+1} = u_n + 50$ indique que l'on ajoute $50$ à chaque itération : `range(N)` et `u + 50`."
        ],
        "expectedAnswer": "`range(N)` et `u + 50`.",
        "solution": "Au départ, la variable `u` est initialisée à $200 = u_0$.\n\n**Premier pointillé.** Pour passer de $u_0$ à $u_N$, il faut appliquer $N$ fois la relation de récurrence (on passe successivement à $u_1$, $u_2$, …, $u_N$). On remplace donc `range(...)` par `range(N)`.\n\n**Second pointillé.** La relation de récurrence est $u_{n+1} = u_n + 50$. À chaque tour, on doit donc ajouter $50$ à la valeur courante de `u`. On remplace `u + ...` par `u + 50`.\n\nLe script complété est :\n\n```python\ndef abonnes(N):\n    u = 200\n    for i in range(N):\n        u = u + 50\n    return u\n```"
      },
      {
        "id": "q6",
        "label": "6.",
        "statement": "Camille espère atteindre $1\\,000$ abonnés. Déterminer, en justifiant par un calcul, le plus petit entier naturel $n$ tel que $u_n \\geq 1\\,000$. À quel mois cela correspond-il ?",
        "marks": 1,
        "hints": [
          "Résous l'inéquation $200 + 50 n \\geq 1\\,000$.",
          "Isole $n$ : $50 n \\geq 800$, donc $n \\geq 16$.",
          "Le plus petit entier $n$ qui convient est $16$. Comme $n = 0$ correspond à janvier 2026, $n = 16$ correspond au $17^\\text{e}$ mois, soit mai 2027."
        ],
        "expectedAnswer": "$n = 16$, ce qui correspond à mai 2027.",
        "solution": "On cherche le plus petit entier naturel $n$ tel que $u_n \\geq 1\\,000$, soit :\n$$200 + 50 n \\geq 1\\,000.$$\n\nEn soustrayant $200$ aux deux membres :\n$$50 n \\geq 800.$$\n\nEn divisant par $50 > 0$ :\n$$n \\geq 16.$$\n\nLe plus petit entier naturel solution est donc $n = 16$. On vérifie : $u_{16} = 200 + 50 \\times 16 = 200 + 800 = 1\\,000$.\n\nComme $n = 0$ correspond à janvier 2026, $n = 16$ correspond au mois situé $16$ mois plus tard, c'est-à-dire **mai 2027**. C'est à ce moment-là que la newsletter dépassera (atteindra) $1\\,000$ abonnés."
      }
    ]
  },
  {
    "id": "e-transverse-bb1-002",
    "chapter": "transverse",
    "title": "Jeu à deux urnes : probabilités conditionnelles et gain moyen",
    "difficulty": 2,
    "estimatedMinutes": 35,
    "totalMarks": 7,
    "order": 20,
    "tags": [
      "probas-cond",
      "arbre",
      "variable-aleatoire",
      "esperance",
      "probas-totales"
    ],
    "preamble": "Dans une fête foraine, on propose le jeu suivant. On lance une pièce de monnaie équilibrée :\n\n- si l'on obtient Pile (événement $P$), on tire au hasard une boule dans une urne $U_1$ contenant $3$ boules vertes et $2$ boules rouges ;\n- si l'on obtient Face (événement $F$), on tire au hasard une boule dans une urne $U_2$ contenant $1$ boule verte et $4$ boules rouges.\n\nOn note $V$ l'événement « la boule tirée est verte » et $R$ l'événement « la boule tirée est rouge ».\n\nLes règles du jeu sont les suivantes : si la boule tirée est verte, le joueur gagne $5$ €, sinon il perd $3$ € (c'est-à-dire que son gain est de $-3$ €).\n\nOn note $X$ la variable aléatoire égale au gain algébrique du joueur, en euros, à l'issue d'une partie.",
    "figure": {
      "type": "tree",
      "data": {
        "orientation": "horizontal",
        "root": {
          "label": "",
          "children": [
            {
              "label": "$P$",
              "weight": "$\\dfrac{1}{2}$",
              "children": [
                {
                  "label": "$V$",
                  "weight": "$\\dfrac{3}{5}$"
                },
                {
                  "label": "$R$",
                  "weight": "$\\dfrac{2}{5}$"
                }
              ]
            },
            {
              "label": "$F$",
              "weight": "$\\dfrac{1}{2}$",
              "children": [
                {
                  "label": "$V$",
                  "weight": "$\\dfrac{1}{5}$"
                },
                {
                  "label": "$R$",
                  "weight": "$\\dfrac{4}{5}$"
                }
              ]
            }
          ]
        }
      },
      "caption": "Arbre pondéré modélisant une partie du jeu."
    },
    "questions": [
      {
        "id": "q1",
        "label": "1.",
        "statement": "Justifier les probabilités $P_P(V) = \\dfrac{3}{5}$ et $P_F(V) = \\dfrac{1}{5}$ portées sur l'arbre.",
        "marks": 0.75,
        "hints": [
          "Une probabilité conditionnelle $P_P(V)$ se calcule dans l'univers réduit à l'événement $P$.",